name,line
707,Cuz u played LOLOL all night lol.
707,Nice~ Can’t believe u get to work straight after college lol
707,In this day and age!
707,Thought they r the same? O_O?
707,Wait!!
707,Think someone entered the chat room;;
707,Hacker!
707,Wait a sec. I’m searching.
707,Maybe?
707,Oh… ^^; Wait.
707,I traced the IP…
707,It’s from Rika’s apartment.
707,"Anyways, someone must have broken into her apt."
707,"It talked now, so it must be a person ^^;"
707,Yup
707,Lolol
707,That’s sexist lol. U should watch what u say now that ur a famous actor.
707,lolol
707,My hands r shaking as I hack.
707,If it doesn’t say anything I’ll hack in and find out.
707,Lol so awkward.
707,I thought it was a computer talking.
707,And wait a sec on the woman thing.
707,Looking it up.
707,Ya. I’m only saying I’m looking it up.
707,No evidence that I’m actually hackginh.
707,Lolol
707,My nickname’s 707.
707,Real name is a secret.
707,U don’t care anyways lol.
707, The name’s too holy to be spread around~ I’m gonna pray after I finish hacking.
707,Just remember me as the 22yr old young hacker lol
707,Where I live is also a secret.
707,So warm and fuzzy here
707,Nothing recent.
707,Oh and also!
707,"You have a better sense of who we are now, MC?"
707,Doubted you’d do it urself.
707,The cat’s name is Elizabeth the 3rd.
707,Oh. U already said lol.
707,My precious privacy!
707,That was so funn~~
707,I want to see the cat again~
707,Yup. It’s for sure…
707,How did it get the apartment password?!
707,Wait.
707,Do u have that person’s username or chat record?
707,I made it impossible to log in without setting a username.
707,Nothing’s in the log…
707,It’s mandatory to set a username so he must have set it that way.
707,Maybe…
707,A hacker…?!
707,A hacker! No way.
707,I have everything covered!
707,"Hey, MC. So he told you the password for the door lock?"
707,Anyways.
707,I should trace the person who distributed the app.
707,Yeah. I think that’s a good idea.
707,I’ll call and explain everything.
707,Already on it lol
707,The evil mastermind.
707,Ya.
707,Wecan.
707,Sorry callingvandtypingwithonehand
707,Lookedintoownerofdevice.
707,she’scutelol
707,thenwhydouplaythisgame
707,youdidntreadsweetfantasyforladies?
707,girl
707,notthereyet
707,iwillifineedtotholol
707,Itolduimahacker.
707,Butnoevidenceididit
707,Ya.
707,Nope~
707,How dare you try to violate someone’s privacy like that.
707,I told him everything through the phone.
707,Uhm. Sorry but…
707,I can’t tell you that.
707,Not even her immediate family can go.
707,And the apartment doesn’t belong to Rika.
707,"Yup. That’s true, but also I’m the one who developed this app."
707,Rika wanted to take care of some work through this too.
707,I went to her place to link the app with some of the documents in her computer.
707,I’m going to go pray for a moment.
707,So then that ‘Unknown’ person…
707,knew Rika!?
707,Hosting parties?
707,But still…
707,Owner of the phone?
707,You were phished lol
707,had the person ‘Unknown’ convince u to go to the apartment.
707,Lol excited because she’s a girl?
707,Insane heart lolololol
707,"Ya. If you don’t cooperate, we can all team up to put u in trouble."
707,"First, we all know that u trespassed on the apartment^^"
707,Uhm. No lol
707,Thank you for ur cooperation.
707,Ya
707,She hosted a fundraiser to help those in need
707,and introduced the guests to one another to arrange business deals.
707,Rika
707,founded the organization called RFA four years ago and hosted two parties until so far.
707,The six of us who knew her personally joined the organization and helped her host the parties.
707,MC has to know this anyways…
707,I guess ur busy right now. Ur replies are really late.
707,Yeah.
707,This app program is not just a simple messenger.
707,All the party related emails in Rika’s computer
707,will be transferred to this app.
707,U’ll be able to automatically receive the guests’ information as well.
707,And send personal messages to other members…
707,I put in all those features so that Rika could work more comfortably.
707,Glad there’s a use for them lol
707,omg
707,I created this chatroom lol.
707,We check that everyone’s alive with this chatroom and literally just chat.
707,Uhm. How do you know she’s pretty? I didn’t even send the photo. 
707,No.
707,Ya. I have to register her before she changes her mind.
707,Good. I’ve registered her as a member! Oh. We don’t really need ur signature.
707,^^… Since it’s a verbal contract.
707,Ya.
707,I’m gonna leave for a sec. Need to check sth.
707,Nah~ It’s work. I have to make a living somehow.
707,How do u know how much I get paid?
707,Oh lol. Did u like the photo?
707,Good job lol.
707,I’m gonna peace out.
707,"Anyways, welcome MC."
707,"Huh? Welcome, MC!"
707,Wow! Isn’t it the infamous MC! Welcome~!
707,lol take the subway.
707,Knew it lol.
707,I want to see her~
707,lmfao
707,Then how about cat man?
707,Trust fund baby cat? Director cat since you’re a Director?… Or~ Father… father or cat mom!
707,…That was a bit too much.
707,I know right? She’s a pretty chill cat.
707,Ya? She’s not picky with me.
707,Lol I can imagine him giving her cat food in his suit.
707,Should I? Then will you let me play with Elizabeth 3rd?
707,Can’t I go over to your place?
707,"Alright, so all I have to do is hang around with this security guard and then go in lol. Okie dokie."
707,Nah~ I love everyone.
707,You don’t have to be careful of me haha
707,Ya?
707,Hmm… Aside from hacking…
707,I fry bacon at the office. I burn music CDs too.
707,Why! Bacon is a huge source of protein!
707,Yup! That’s right.
707,Wow! Ur like the only one who gets me in this group.
707,I am not dangerous~!
707,Ur cat is alive and well haha
707,I want to play with Elizabeth again haha
707,Maybe I should get a cat?
707,"Anyways, thanks for getting me, MC!"
707,I am also very devoted to my religion.
707,My heart is full of love and peace!
707,Why can’t anyone recognize the love inside of me?
707,What’s that?
707,"Well, I had no choice because it was top secret."
707,I’m in charge of managing top secret information lol.
707,Wow! She thinks I’m funny.
707,"I’d like to gift u the thrill and joy of riding a roller coaster, MC!"
707,"Ya. But it was just once, and I don’t even remember where it is now~"
707,I just went to install AP…
707,I was only working hard for the organization T_T
707,Is my brain that big?
707,I dunno about any secrets~
707,lol
707,lolololololol
707,"lol well, I guess… I do have secrets."
707,Since I take care of classified information~!
707,"Ya, a bit."
707,I am a bit of the secretive type.
707,Don’t fear me.
707,"If u come over to my place, I’ll give u a smothering hug."
707,Cheer up! Whoot whoot!
707,I’ll give u the proper cat mom send off.
707,Good bye for meow~★
707,No one knows how affectionate I can be lol
707,Right?
707,I hope u believe me.
707,Okay…
707,Thank you.
707,"Ur a nice person, MC!"
707,lol
707,Okay. Hope u make the right decision~
707,I can’t change how u think.
707,I’ll peace out now.
707,I have to work T_T
707,The company’s lucky to have me as their slave…
707,Laterz
707,I’ll be waiting until the day we get to talk again.
707,^^
707,Let’s see if I can research more on MC.
707,Ok. I will make an exception and let you in on some info.
707,"She’s a girl. Young. In my standard, she is cute."
707,Two beautiful eyes and pink lips.
707,She must be reading this conversation through her smartphone.
707,"That’s enough, right?"
707,"Ok, I don’t."
707,Hmm…
707,Hmmmm~.
707,I’m actually not doing a background check on her… I’m searching for the person who sent MC to Rika’s apartment.
707,As always~
707,Maybe.
707,I can’t help it tho T_T
707,Why would the information be called ‘classified’?
707,I have to leave now. Just got more work~
707,Ok.
707,Clap everyone~!
707,Huh? Hey MC~
707,Glad you came lol
707,Hey babe~
707,omg.
707,That was a bit disgusting just now.
707,Ur hard to beat…MC…ugh.
707,Even I can’t handle it.
707,Can’t believe someone beat me…T_T
707,lololol
707,lolololol
707,Sorry.
707,To be honest.
707,I came to procrastinate  because I couldn’t focus on work.
707,Why can’t I focus?
707,Because I like u?
707,…Is it that?
707,Hmm… If u and my Star Wars lego spaceship both drown
707,then I will shout to u to get on that spaceship and escape.
707,…Is this…
707,what people call
707,LO
707,Maybe that’s why?
707,I guess I need Elizabeth 3rd.
707,Maybe I should kidnap her ^^
707,SO
707,MUCH
707,FUN lolol
707,I don’t drink coffee.
707,"I don’t drink coffee, alcohol, or smoke. The only thing I drink is PhD. Pepper."
707,I’m a nice guy who doesn’t do anything bad!
707,I only ethically hack.
707,Hmm…
707,…Yes.
707,"To be honest, I found something cute about u."
707,The password for ur online shopping mall account and ur email account
707,are
707,the
707,same!
707,It’s so cute….lololol
707,Hmm. How did I?
707,I don’t know lol
707,I told you. I was only pretending to hack ur accounts.
707,I’m only researching about that ‘Unknown’ person.
707,What? They r?
707,Hmm…
707,Joke failed!
707,I told you. I was only pretending to hack ur accounts.
707,I’m only researching about that ‘Unknown’ person.
707,"Okay, joke’s over."
707,"To be honest, what I was thinking was…"
707,What if Rika was alive?
707,I can’t get that thought out of my head.
707,Yes I do.
707,If only I could give up my life to get her to come back…
707,It would be nice if only I could do that.
707,She did more good to the world than I would ever do.
707,"If it weren’t for Rika, I wouldn’t be here right now."
707,^^
707,Hmm..
707,I really wish so ^^
707,She was such a good person.
707,There needs to be more people like her… in this world.
707,That would be nice…
707,but I don’t think so.
707,But…
707,I’m sure it’s someone that has to do sth with Rika.
707,So…
707,I really want to find that person.
707,Thinking about this makes me sad.
707,Of course lolol
707,That’s actually a photo of me lol
707,My boss said that everyone would be more productive if I cross-dress
707,so I made this enormous sacrifice for everyone lolol
707,This is…
707,a photo of me lolololololol
707,>_<
707,I don’t like talking about depressing and serious things.
707,I hope there’s only happiness.
707,R u smiling at my photo?
707,I hope u r ^^
707,Ya
707,"My company said that it would be fun, so I did it."
707,lololololol
707,"If I can make everyone happy, then why not…"
707,It was pretty fun lolol
707,"Anyways,"
707,I’m continuing the research on the person who took you to Rika’s apartment.
707,But what I’m worried about…
707,is the possibility that u r in danger.
707,"If that ‘Unknown’ person is not somehow related to Rika, then it means a third party"
707,knows information about the RFA and ur location.
707,If anything happens…
707,please come to this chatroom.
707,^^
707,Even though I can’t be the knight in shining armor to protect u
707,I want to be able to tell the knight who the villain is.
707,I like that attitude lolol
707,Just be safe.
707,Don’t suddenly disappear or anything like that. ^^
707,I think I have to peace out now.
707,It’s getting dark.
707,I’m the one to thank u for listening to me.
707,"Yes, have a good evening."
707,Then peace out.
707,Hey MC!
707,I was just too busy in the morning to log in…
707,I guess he missed me lol
707,I’m sure I’ll get close with u soon lol
707,I worked so hard during the weekend that my shoulders are soooo stiff >_<
707,I didn’t lol. U can look at the chat history.
707,I’m innocent >_<
707,I feel nothing but love for that cat
707,You mean you sneeze lol achew achew
707,But it’s so cute lol
707,lololol which do u hate more lolol
707,lololol u still haven’t gotten over ur fur allergy? lolol
707,lolololol But cats r so cute tho
707,I never abuse her~~ I just play with her.
707,I just well~~~ hug~~~ her
707,and~~~ rub my cheeks on her
707,and~~ hug her
707,and run in circles
707,and I run around with her in my arms lol
707,lol she gets me! yay!
707,Oh~ Yeah. That’s true.
707,Dunno. Don’t remember.
707,No… Pay me if u want me to know…
707,U don’t know car poor? Car hobo.
707,I heard they have a lot of money meow~
707,Big profit for the party meow.
707,Gahh… I got to work. I have to go lol
707,U want to know?
707,But!
707,It’s~ a secret~.
707,Get it on you two.
707,Bye~
707,"Oh, it’s MC."
707,MC has entered.
707,lolol I get to talk with MC.
707,So exciting~.
707,I feel good cuz I finished work earlier than I expected.
707,lol
707,Huh? But…
707,Yes.
707,It’s been so long since I saw his face…
707,I’m gonna forget what he looks like soon.
707,I really hope he tells us the plans fast
707,and we get to hold the party again haha
707,Then so many fun things will happen~~
707,Hmm lol
707,For example…
707,The company I work for right now never gives me days off…
707,But they’ll be forced to give me a holiday.
707,So excited to see the boss’ angry face.
707,…It just means I’m ditching work for a week without asking ^^
707,lololol
707,Why~
707,I don’t have to go to work during the party lol
707,I want to go to have the party soon~~
707,Howdy
707,He must have seen everything we said about the party.
707,Since MC joined the organization
707,we were pretty busy just talking about the party.
707,that says it all.
707,I hope it’s soon.
707,It’s being delayed because of security issues.
707,Ya. Seems so.
707,lololol that’s positive~!
707,omg that’s too harsh!
707,Who the hell would do that.
707,!?
707,Oh the tragic fate of an employee…
707,W…
707,I don’t know how it’s gonna play out…
707,But I want the party fast~
707,I want to give a 90’s greeting~
707,"Yo, yo, homie Joe."
707,"And the law says that work hours are from 00 to 24, right?"
707,Since he can take care of things without hearing her voice?
707,I’m not good at studying too.
707,lololol love the honesty
707,Maybe u have zero interest?
707,lol Don’t worry too much.
707,If you end up hacking beyond national borders you get to memorize world geography pretty quick.
707,I heard young people these days are depressed because of things like that.
707,lololol
707,"Well, they aren’t really on good terms…"
707,;;;
707,That is true…
707,Now that I think about it…
707,Omg;
707,I don’t know…
707,He wasn’t… exactly well.
707,"Even now,"
707,Endless misunderstandings
707,Is our cute Elizabeth doing well?
707,omg
707,If u get older…
707,u become more numb to things like that.
707,I feel that he may be hiding something
707,but I don’t think that he’s changed a lot.
707,That’s what I’m doing right now.
707,That’s nothing new~.
707,A brother hating the sister’s husband is
707,a cliche soap opera story.
707,Ya
707,Hmm~.
707,I did try tracing him…
707,but didn’t find much.
707,"Thanks for saying, MC."
707,But to be honest…
707,Nah
707,It’s not really about that…
707,I kept digging and it seemed…
707,to be related to a religious organization.
707,I was about to look into it more… but I’m just going to keep an eye out for now.
707,"Nah, that’ll never happen."
707,Really?
707,Hmm~.
707,"Okay, I’ll keep that in mind."
707,I’ll have to collect more data.
707,The information isn’t conclusive yet so don’t overreact.
707,"If it’s related to Rika, I’ll make sure to tell u."
707,lol nothing’s hard~ it’s dine.
707,I’ll go get some shut eye now.
707,I stayed up all night working till this afternoon T_T
707,I can’t even keep my eyes open right now…
707,Nah. Got a burger.
707,I’m gonna work hard and die fast.
707,Have no desire to live long lol
707,lol aight.
707,Mehhh~~
707,"Anyways, bye~"
707,Spying.
707,Just kidding~ lol
707,She’s ur fan.
707,lololol
707,How comical.
707,He’s denying what she’s trying so hard to make clear.
707,lololol
707,lololol
707,lolol
707,MC.
707,Can I ask u a question?
707,What kind of a woman do you think would suit me?
707,lololololololol
707,Sorry lololol
707,Alien…
707,Someone brave!
707,Don’t u dare ignore a woman’s sixth sense yo
707,Coreana sitting across from next next next to me said so yo
707,Maybe u r foolish
707,The absolute truth is that
707,all women who care for looks will definitely like you lol
707,Just admit it lolol
707,U make a living out of people who care for looks lolol
707,Ur youtube views are all because of ur face lol
707,ermahgerd
707,I do think that ur going to become a celebrity or a movie star soon tho.
707,Ya that’s true.
707,I doubt u’d change~
707,"U don’t show off, u have no other passion~"
707,Ur a total workaholic lololol
707,U are a bit narcissistic but still lolololol
707,But still~
707,It feels good when more people recognize ur talent~
707,Surrounded by people The popularity!
707,Fame!
707,It’s a huge happiness to have ur name known.
707,Feeling satisfied in a small pond is ungrateful!
707,I helped u in the hopes u’d escape that small pond~! ++
707,Ahem~!
707,U went super viral because it worked lolol
707,"But ultimately, everything worked out right? lolol"
707,He brought a bunch of sponsors to host a huge event
707,and u just kicked it
707,all away~
707,He just doesn’t like him.
707,Ya I think he’s jelly.
707,lolololol makes no sense
707,!
707,I have to go work now.
707,Ya
707,"Anyways, congrats on ur new role."
707,thx ^^
707,"Oh, MC."
707,Ur here ^^
707,Who did u meet with? Were they fun people?
707,Who did you meet with?
707,Oh ho~
707,omg sugar-coated words.
707,What a powerful combination.
707,Moi?
707,I’m waiting until my boss calls.
707,I don’t really have set work hours…
707,If u don’t have set work hours
707,ur practically the company’s slave and not an employee.
707,omg
707,Will they sign?
707,"Since we’re talking about it, u guys should ask that cultured something organization to come to the party."
707,"Hmm~ If MC thinks so, we have no choice."
707,Uhm… I like fun people coming to the party lol
707,I
707,Oh yeah!
707,U know I read a lot of fantasy novels?
707,The movie called Lady of the Bracelets is a masterpiece
707,and I heard that the Lady really exists.
707,Yeah… I want to see more of that animal lol
707,Noooo
707,I know that animal is not real lol
707,I’m not that stupid!
707,lolol Can’t u try looking for her?
707,"lolol Anyways, I really want to meet the Lady of the Bracelets."
707,We went to see the movie Lady of the Bracelets together lolol
707,Oh?
707,"MC, u already know his taste."
707,"lolololol Yeah, find her! lolol"
707,lololol Yeah!
707,Tell me if you find something!
707,I just got work. Disappearing now!
707,Yo…
707,Is anyone here?
707,Yay! It’s you.
707,"You both, plz listen to me."
707,"MC, you were here too."
707,I was trapped inside all day and had to work T_T
707,Wow
707,I must have done something wrong to MC.
707,T_T
707,It’s difficult to say…
707,Ya. Ur right.
707,"The day I reveal top secret information, I might be gone from this world before I know it."
707,It’s a place I’m working part time as a freelancer
707,and they just lock people in for security reasons…
707,"So if I reveal classified information, they’ll probably torture me in the basement…"
707,omg
707,T_T…
707,Ya…
707,I’m a dangerous person so be careful lolol
707,Yeah… Thank you.
707,It’s been a while since I’ve heard something like that.
707,Someone’s worrying for me. So touching!
707,Oh!
707,Is that so!?
707,I am a sensitive person… A creature with a clear innocent heart like a gentle lamb.
707,I am showing my vulnerability right now.
707,Save me T_T
707,What did I ever do T_T
707,I’m a nice person. Don’t say that lolol
707,We can just be friends ^^
707,Ya?
707,Oh…
707,"” I do not really understand what made you say that, but as someone who’s had a considerable amount of life experiences, I cannot say that I have never been in a relationship and I am not an innocent girl who has no experience whatsoever”"
707,You mean this?
707,You can’t take back what’s happened in the past! Unless you have a time machine!
707,Hmm…
707,Then it’s best not to say anything vague like that.
707,Liking someone is selfish.
707,It clouds your mind and makes you do and say things you normally wouldn’t.
707,"But the better you control that, the more control you have over relationships."
707,You can prevent any potential problems and have the upper hand in the relationship.
707,Although loneliness will follow you always (u x YOU o )
707,lololol I don’t know.
707,I don’t really understand what this means.
707,It says so…
707,…in the book called ‘Expert Playboy’.
707,lololol
707,lololololololol
707,Only because I like to read a variety of books.
707,Read it and become a playboy yo.
707,I’m going to get some sleep too… >_<
707,My eyes keep closing.
707,Yeah. Goodbye.
707,Heya MC
707,Ya. Slept like a rock.
707,I don’t feel tired physically..
707,But
707,"mentally, my stress level is MAX"
707,How do I get rid of this stress…?!
707,o_o Game??
707,lol
707,I’d rather make one. Playing it gets boring pretty fast lol
707,Hmm.
707,heya
707,What were u doing?
707,So late at night lol
707,Coffee…?
707,Ur learning how to make coffee…???
707,No way. U can’t.
707,Did you already drink the coffee!?!?!?!?
707,Big trouble…
707,It’s…
707,Gah… I was about to tell MC.
707,"So, I check the health reports of all the members…"
707,Ya…
707,U can never ever!!! drink coffee.
707,"Seeing ur typos above, it seems like ur showing symptoms are showing already."
707,U can never ever!!! drink coffee.
707,"If u do, ur hands will start shaking and u’ll faint eventually."
707,…
707,I’m sorry.
707,U’ve already lost trust in me
707,so u r not listening
707,Ur gonna faint. For real.
707,Ya. Go prepare to faint.
707,You are going to faint today.
707,And there’s a chance you might never wake up again…
707,You have the “Pass Out After Drinking Caffeine Syndrome”
707,Ya
707,…Don’t get so surprised.
707,The disease called “Pass Out After Drinking Caffeine Syndrome”
707,It
707,exists
707,for sure.
707,I look at foreign reports every day.
707,Wiki picture
707,…It’s a rare disease.
707,Oh! That number’s nice. It’s the 10th multiple of 2.
707,According to my data
707,u’ll faint some time between 9 and 10.
707,Ya
707,lol it’s nothing
707,Oh.
707,I recommend drinking chocolate milk before u faint.
707,U have to increase ur blood pressure if u want to wake up faster.
707,I’m worried…T_T
707,Ya. Dealing it wisely is the way to go.
707,…I’m glad to be of help.
707,"Ur young, so u’ll wake up quickly if u do faint, so don’t worry too much."
707,Oh… I got work again.
707,Arrgghh!! Stress!!!
707,Can’t do anything about it…
707,Then I’ll get going.
707,lol
707,U can trust me… ^^
707,Ya. I donated a lot too.
707,Heya MC.
707,A group of developers… and what was the other place.
707,Anyways I donated my talent and gave some lectures. lol
707,Ahem lol
707,I went to the developers meeting and gave them USBs with viruses as gifts ^^
707,Everyone will study to try to get rid of it.
707,"Ultimately, it brings good results ^^"
707,My trade & talent donation ^^
707,Oh. You did?
707,"Don’t worry, I’ll make sure he goes well."
707,Oh!! Right!!
707,Did you… turn on a humidifier in ur room?
707,Yeah…
707,That
707,is
707,because
707,omg it’s already time.
707,We’re in trouble.
707,What do we do about the humidifier.
707,do u have any last words
707,If u don’t turn on a humidifier… u will…
707,I’m sorry.
707,For not being able to protect u.
707,Ya. Hurry up.
707,I think he meant his hands are shaking.
707,"Ya. Well, something like that."
707,You forgave him. Good.
707,It’s MC~ lol
707,Hey hey
707,lmafoooooo
707,Not long till I refer him to a doctor.
707,That’s good for him lol
707,I think she is.
707,So nosy lol
707,Think it’s just for ur interests.
707,Why do u sound like the dean of a private school?
707,Jealous?
707,lololol
707,This isn’t a school.
707,U should date whoever u want to lol
707,"Right. MC, maybe you are jealous lolol"
707,Hysteric women are so scary~~! >.<
707,Scary~ >.<
707,I want to see my Elly~
707,But not now…
707,I’m about to pass out..
707,I’m falling…
707,asleep….Zzzz
707,Zzzz
707,Awake again.
707,I have something to say.
707,I found her.
707,The lady.
707,"…Not her, the Lady of the Workbaskets."
707,Ahem!
707,lololol
707,I’m serious.
707,She’s an amazing lady who made workbaskets for 15 years.
707,^^ The world is full of possibilities.
707,Right.
707,Endless possibilities.
707,The beauty of this world.
707,This world! So beautiful!!
707,Oh…
707,Someone understands this!!
707,We’re meant to be!?
707,I thought u said members shouldn’t date each other?
707,!!!
707,Wow! I wanted to get married at the space station too!
707,We have to invite her to the party.
707,I’ll get to meet the master of workbaskets…!
707,Hell yes!
707,I’ll tell her to send u an email.
707,So excited!!
707,Oh….
707,My eyes are closing…
707,Z
707,Zzz
707,The main character always comes last.
707,"Hey, MC!"
707,Wanna drink some chocolate milk.
707,"Yes, I understand u hating me ^^"
707,But thanks to that ur no longer playing games.
707,Yup. Thank me.
707,It is thanks to me.
707,Without that incident
707,and the supermarket wouldn’t have seen profit go up
707,I wouldn’t have found out who broke my precious figurine
707,"No, actually never mind. This isn’t really important."
707,Ahem lol
707,"Anyways, you who broke my toy"
707,are forgiven!!
707,From a gloomy life!
707,"Without a girlfriend, without games…"
707,a clean life like a potato salad without mayo
707,a life like a worn out hoodie.
707,You have been saved from that life.
707,You were able to reach enlightenment.
